{"canonicalization":"ELITEA_TEST_JSON_CANONICAL_V1","entries":[{"content":{"blob_name":"blobs/sha256/ca3d163bab055381827226140568f3bef7eaac187cebd76878e0b63e9e442356","byte_length":3,"classification":"synthetic","content_id":"configuration-validation-unsupported-settings-v1","digest":"sha256:ca3d163bab055381827226140568f3bef7eaac187cebd76878e0b63e9e442356","immutable_version":"configuration-revision-unsupported-v1","media_type":"application/json","required_grant_audience":"elitea.runtime.input.read.v1"},"entry_id":"settings","immutable_version":"configuration-revision-unsupported-v1","semantic_role":"configuration.settings"}],"input_bundle_manifest":{"blob_name":"input-bundle.pb","byte_length":354,"digest":"sha256:ff56d486163f081e2da1367a457965834ab748d9972447db512b6c223ec4428c","media_type":"application/x-protobuf"},"profile":"TEST_ONLY_OFFLINE_CONFORMANCE_V1","schema_version":"elitea.runtime.fixture-bundle.v1"}
